{
  "$schema": "https://json-schema.org/draft/2020-12/schema",
  "$id": "https://render-scope.web.app/schemas/benchmark.schema.json",
  "title": "RenderScope Benchmark Result",
  "description": "A single benchmark run: one renderer, one scene, one hardware configuration.",
  "type": "object",
  "required": [
    "id",
    "renderer",
    "renderer_version",
    "scene",
    "timestamp",
    "hardware",
    "settings",
    "results"
  ],
  "additionalProperties": false,
  "properties": {
    "id": {
      "type": "string",
      "description": "Unique identifier in the format '{scene}-{renderer}-{hardware}-{YYYY-MM-DD}'. The hardware component keeps two contributors who benchmark the same renderer and scene on the same day from colliding. Generated for you by 'renderscope publish'.",
      "pattern": "^[a-z0-9-]+$"
    },
    "renderer": {
      "type": "string",
      "description": "Renderer id (must match a file in /data/renderers/)."
    },
    "renderer_version": {
      "type": "string",
      "description": "Exact renderer version used for this benchmark run."
    },
    "scene": {
      "type": "string",
      "description": "Scene id (must match a file in /data/scenes/)."
    },
    "timestamp": {
      "type": "string",
      "description": "ISO 8601 datetime with timezone when the benchmark was run.",
      "format": "date-time"
    },
    "hardware": {
      "type": "object",
      "description": "Hardware configuration used for this benchmark.",
      "required": ["cpu", "ram_gb", "os"],
      "additionalProperties": false,
      "properties": {
        "id": {
          "type": "string",
          "description": "Hardware configuration identifier (e.g., 'hw1')."
        },
        "label": {
          "type": "string",
          "description": "Human-readable label for this hardware configuration."
        },
        "cpu": {
          "type": "string",
          "description": "CPU model name."
        },
        "cpu_cores": {
          "type": "integer",
          "description": "Number of physical CPU cores.",
          "minimum": 1
        },
        "cpu_threads": {
          "type": "integer",
          "description": "Number of CPU threads (including hyperthreading).",
          "minimum": 1
        },
        "gpu": {
          "type": ["string", "null"],
          "description": "GPU model name, or null if CPU-only run."
        },
        "gpu_vram_gb": {
          "type": "number",
          "description": "GPU VRAM in gigabytes.",
          "minimum": 0
        },
        "ram_gb": {
          "type": "number",
          "description": "System RAM in gigabytes.",
          "minimum": 0
        },
        "os": {
          "type": "string",
          "description": "Operating system name and version."
        },
        "driver": {
          "type": "string",
          "description": "GPU driver name and version string."
        },
        "driver_version": {
          "type": "string",
          "description": "GPU driver version."
        }
      }
    },
    "settings": {
      "type": "object",
      "description": "Render settings used for this benchmark.",
      "required": ["resolution"],
      "additionalProperties": false,
      "properties": {
        "resolution": {
          "type": "array",
          "description": "Output resolution as [width, height].",
          "items": {
            "type": "integer",
            "minimum": 1
          },
          "minItems": 2,
          "maxItems": 2
        },
        "samples_per_pixel": {
          "type": ["integer", "null"],
          "description": "Number of samples per pixel. Null for rasterization renderers.",
          "minimum": 1
        },
        "time_budget_seconds": {
          "type": ["number", "null"],
          "description": "Time budget in seconds (alternative to samples_per_pixel).",
          "minimum": 0
        },
        "integrator": {
          "type": "string",
          "description": "Rendering integrator or algorithm name (renderer-specific)."
        },
        "max_bounces": {
          "type": "integer",
          "description": "Maximum ray bounce depth.",
          "minimum": 0
        },
        "threads": {
          "type": "integer",
          "description": "Number of CPU threads used.",
          "minimum": 1
        },
        "gpu_enabled": {
          "type": "boolean",
          "description": "Whether GPU rendering was used."
        },
        "denoiser": {
          "type": ["string", "null"],
          "description": "Denoiser used, if any (e.g., 'OIDN', 'OptiX')."
        },
        "renderer_type": {
          "type": "string",
          "description": "Rendering paradigm. Enables paradigm-aware display in dashboards.",
          "enum": ["path_tracing", "rasterization", "scientific_visualization"]
        },
        "frame_count": {
          "type": "integer",
          "description": "Number of frames rendered (for rasterization benchmarks).",
          "minimum": 1
        },
        "warmup_frames": {
          "type": "integer",
          "description": "Number of warm-up frames discarded before measurement.",
          "minimum": 0
        },
        "msaa_samples": {
          "type": "integer",
          "description": "MSAA sample count for anti-aliasing (rasterization renderers).",
          "minimum": 1
        },
        "ospray_renderer": {
          "type": "string",
          "description": "OSPRay renderer backend type (e.g., 'pathtracer', 'scivis', 'ao')."
        },
        "extra": {
          "type": "object",
          "description": "Renderer-specific settings not covered by standard fields."
        }
      }
    },
    "results": {
      "type": "object",
      "description": "Benchmark results.",
      "required": ["render_time_seconds", "output_image"],
      "additionalProperties": false,
      "properties": {
        "render_time_seconds": {
          "type": "number",
          "description": "Total wall-clock render time in seconds.",
          "exclusiveMinimum": 0
        },
        "peak_memory_mb": {
          "type": "number",
          "description": "Peak memory usage during rendering in megabytes.",
          "minimum": 0
        },
        "output_image": {
          "type": "string",
          "description": "Relative path to the full-resolution output image."
        },
        "output_image_web": {
          "type": "string",
          "description": "Relative path to the web-optimized output image (WebP)."
        },
        "frame_time_ms_median": {
          "type": "number",
          "description": "Median frame time in milliseconds (rasterization benchmarks).",
          "exclusiveMinimum": 0
        },
        "frame_time_ms_mean": {
          "type": "number",
          "description": "Mean frame time in milliseconds (rasterization benchmarks).",
          "exclusiveMinimum": 0
        },
        "frame_time_ms_min": {
          "type": "number",
          "description": "Minimum frame time in milliseconds (rasterization benchmarks).",
          "exclusiveMinimum": 0
        },
        "frame_time_ms_max": {
          "type": "number",
          "description": "Maximum frame time in milliseconds (rasterization benchmarks).",
          "exclusiveMinimum": 0
        },
        "frame_time_ms_p95": {
          "type": "number",
          "description": "95th percentile frame time in milliseconds (rasterization benchmarks).",
          "exclusiveMinimum": 0
        },
        "frame_count": {
          "type": "integer",
          "description": "Total number of frames rendered (rasterization benchmarks).",
          "minimum": 1
        }
      }
    },
    "quality_vs_reference": {
      "type": "object",
      "description": "Image quality metrics compared to a reference render.",
      "required": ["reference_renderer", "reference_samples"],
      "additionalProperties": false,
      "properties": {
        "reference_renderer": {
          "type": "string",
          "description": "Renderer id used for the reference image."
        },
        "reference_samples": {
          "type": "integer",
          "description": "Sample count used for the reference image.",
          "minimum": 1
        },
        "psnr": {
          "type": "number",
          "description": "Peak Signal-to-Noise Ratio in dB."
        },
        "ssim": {
          "type": "number",
          "description": "Structural Similarity Index (0.0 to 1.0).",
          "minimum": 0,
          "maximum": 1
        },
        "mse": {
          "type": "number",
          "description": "Mean Squared Error.",
          "minimum": 0
        },
        "lpips": {
          "type": ["number", "null"],
          "description": "Learned Perceptual Image Patch Similarity (0.0 to 1.0, lower is better).",
          "minimum": 0,
          "maximum": 1
        }
      }
    },
    "convergence": {
      "type": "array",
      "description": "Convergence data points for progressive renderers, showing quality at increasing sample counts.",
      "items": {
        "type": "object",
        "required": ["samples"],
        "additionalProperties": false,
        "properties": {
          "samples": {
            "type": "integer",
            "description": "Sample count at this data point.",
            "minimum": 1
          },
          "time": {
            "type": "number",
            "description": "Wall-clock time in seconds at this sample count.",
            "minimum": 0
          },
          "time_seconds": {
            "type": "number",
            "description": "Wall-clock time in seconds at this sample count (alias for 'time').",
            "minimum": 0
          },
          "psnr": {
            "type": "number",
            "description": "PSNR at this sample count."
          },
          "ssim": {
            "type": "number",
            "description": "SSIM at this sample count.",
            "minimum": 0,
            "maximum": 1
          }
        }
      }
    },
    "notes": {
      "type": "string",
      "description": "Freeform notes about this benchmark run."
    },
    "submitted_by": {
      "type": "string",
      "description": "GitHub username of the person who submitted this result."
    }
  }
}
