{
  "id": "sponza-blender-cycles-hw2-2025-01-02",
  "renderer": "blender-cycles",
  "renderer_version": "4.1.0",
  "scene": "sponza",
  "timestamp": "2025-01-02T11:30:00Z",
  "hardware": {
    "id": "hw2",
    "label": "Mid-Range Laptop",
    "cpu": "Intel Core i7-13700H",
    "gpu": "NVIDIA RTX 4060 Laptop",
    "ram_gb": 32,
    "os": "Windows 11",
    "driver": "NVIDIA 546.33"
  },
  "settings": {
    "resolution": [1920, 1080],
    "samples_per_pixel": 1024,
    "integrator": "path_tracing",
    "max_bounces": 12,
    "threads": 16,
    "gpu_enabled": true
  },
  "results": {
    "render_time_seconds": 142.8,
    "peak_memory_mb": 1920,
    "output_image": "renders/sponza/blender-cycles_1024spp_hw2.exr"
  },
  "quality_vs_reference": {
    "reference_renderer": "pbrt",
    "reference_samples": 65536,
    "psnr": 38.7,
    "ssim": 0.9946,
    "mse": 0.000135
  },
  "convergence": [
    { "samples": 1, "time": 0.14, "psnr": 9.6 },
    { "samples": 4, "time": 0.56, "psnr": 15.8 },
    { "samples": 16, "time": 2.22, "psnr": 22.1 },
    { "samples": 64, "time": 8.82, "psnr": 28.3 },
    { "samples": 256, "time": 35.0, "psnr": 34.0 },
    { "samples": 1024, "time": 142.8, "psnr": 38.7 }
  ]
}
