{
  "id": "classroom-luxcorerender-hw1-2024-12-06",
  "renderer": "luxcorerender",
  "renderer_version": "2.7.0",
  "scene": "classroom",
  "timestamp": "2024-12-06T09:30:00Z",
  "hardware": {
    "id": "hw1",
    "label": "High-End Desktop",
    "cpu": "AMD Ryzen 9 7950X",
    "gpu": "NVIDIA RTX 4080",
    "ram_gb": 64,
    "os": "Ubuntu 22.04",
    "driver": "NVIDIA 545.29.06"
  },
  "settings": {
    "resolution": [1920, 1080],
    "samples_per_pixel": 1024,
    "integrator": "pathgpu",
    "max_bounces": 10,
    "threads": 32,
    "gpu_enabled": true
  },
  "results": {
    "render_time_seconds": 42.1,
    "peak_memory_mb": 1380,
    "output_image": "renders/classroom/luxcorerender_1024spp.exr"
  },
  "quality_vs_reference": {
    "reference_renderer": "pbrt",
    "reference_samples": 65536,
    "psnr": 40.6,
    "ssim": 0.9968,
    "mse": 0.000087
  },
  "convergence": [
    { "samples": 1, "time": 0.04, "psnr": 10.9 },
    { "samples": 4, "time": 0.17, "psnr": 17.2 },
    { "samples": 16, "time": 0.65, "psnr": 23.5 },
    { "samples": 64, "time": 2.60, "psnr": 29.8 },
    { "samples": 256, "time": 10.3, "psnr": 35.7 },
    { "samples": 1024, "time": 42.1, "psnr": 40.6 }
  ]
}
